,株式コード,ＥＤＩＮＥＴコード,上場区分,連結の有無,資本金,提出者名,所在地,提出者業種,緯度,経度,都道府県名
163,9433.T,E04425,上場,有,141852.0,ＫＤＤＩ株式会社,新宿区西新宿二丁目３番２号,情報・通信業,35.687929,139.69483799999998,東京都
164,9434.T,E04426,上場,有,204309.0,ソフトバンク株式会社,港区海岸一丁目７番１号,情報・通信業,35.655214,139.76067,東京都
165,9432.T,E04430,上場,有,937950.0,日本電信電話株式会社,千代田区大手町一丁目５番１号,情報・通信業,35.685704,139.763744,東京都
166,9503.T,E04499,上場,有,489320.0,関西電力株式会社,大阪市北区中之島３丁目６番１６号,電気・ガス業,34.692640999999995,135.492568,大阪府
167,9506.T,E04501,上場,有,251441.0,東北電力株式会社,仙台市青葉区本町一丁目７番１号,電気・ガス業,38.265586,140.87833899999998,宮城県
168,9502.T,E04502,上場,有,430777.0,中部電力株式会社,名古屋市東区東新町１番地,電気・ガス業,35.169939,136.913687,愛知県
169,9531.T,E04514,上場,有,141844.0,東京瓦斯株式会社,港区海岸一丁目５番２０号,電気・ガス業,35.65345,139.758554,東京都
170,9533.T,E04517,上場,有,33072.0,東邦瓦斯株式会社,名古屋市熱田区桜田町１９番１８号,電気・ガス業,35.140535,136.90911,愛知県
171,9532.T,E04520,上場,有,132166.0,大阪瓦斯株式会社,大阪市中央区平野町四丁目１番２号,電気・ガス業,34.688288,135.500537,大阪府
172,4661.T,E04707,上場,有,63201.0,株式会社オリエンタルランド,浦安市舞浜１番地１,サービス業,35.626359,139.884619,千葉県
173,4324.T,E04760,上場,有,74609.0,株式会社電通グループ,港区東新橋一丁目８番１号,サービス業,35.664442,139.76238700000002,東京都
174,8591.T,E04762,上場,有,221111.0,オリックス株式会社,港区浜松町２丁目４番１号世界貿易センタービル南館内,その他金融業,35.654586,139.756251,東京都
175,9735.T,E04773,上場,有,66392.0,セコム株式会社,渋谷区神宮前一丁目５番１号,サービス業,35.671326,139.70712,東京都
176,9719.T,E04830,上場,有,21152.0,ＳＣＳＫ株式会社,江東区豊洲三丁目２番２０号,情報・通信業,35.656877,139.79566200000002,東京都
177,9684.T,E04859,上場,有,23664.0,株式会社スクウェア・エニックス・ホールディングス,新宿区新宿六丁目２７番３０号,情報・通信業,35.696684999999995,139.70869199999999,東京都
178,9613.T,E04911,上場,有,142520.0,株式会社エヌ・ティ・ティ・データ,江東区豊洲三丁目３番３号,情報・通信業,35.655846000000004,139.7963,東京都
179,9435.T,E04948,上場,有,54259.0,株式会社光通信,豊島区西池袋一丁目４番１０号,情報・通信業,35.728321,139.708981,東京都
180,4704.T,E04999,上場,有,18386.0,トレンドマイクロ株式会社,渋谷区代々木二丁目１番１号新宿マインズタワー,情報・通信業,35.686541,139.698851,東京都
181,4689.T,E05000,上場,有,237404.0,Ｚホールディングス株式会社,千代田区紀尾井町１番３号,情報・通信業,35.679584000000006,139.736897,東京都
182,4684.T,E05025,上場,有,19178.0,株式会社オービック,中央区京橋二丁目４番１５号,情報・通信業,35.676667,139.76926,東京都
183,4716.T,E05027,上場,無,24935.0,日本オラクル株式会社,港区北青山２丁目５番８号,情報・通信業,35.671171,139.718615,東京都
184,4739.T,E05059,上場,有,21764.0,伊藤忠テクノソリューションズ株式会社,港区虎ノ門四丁目１番１号,情報・通信業,35.665437,139.745261,東京都
185,4307.T,E05062,上場,有,22414.0,株式会社野村総合研究所,千代田区大手町一丁目９番２号,情報・通信業,35.688781,139.764566,東京都
186,4751.T,E05072,上場,有,7203.0,株式会社サイバーエージェント,渋谷区宇田川町４０番１号,サービス業,35.662469,139.696102,東京都
187,4755.T,E05080,上場,有,205924.0,楽天グループ株式会社,世田谷区玉川一丁目１４番１号,サービス業,35.610552,139.630067,東京都
188,4768.T,E05099,上場,有,10374.0,株式会社大塚商会,千代田区飯田橋二丁目１８番４号,情報・通信業,35.69978,139.750922,東京都
189,2331.T,E05309,上場,有,18675.0,綜合警備保障株式会社,港区元赤坂一丁目６番６号,サービス業,35.678369,139.73328600000002,東京都
190,8439.T,E05346,上場,有,81129.0,東京センチュリー株式会社,千代田区神田練塀町３番地富士ソフトビル,その他金融業,35.700306,139.774074,東京都
191,3769.T,E05476,上場,有,4712.0,ＧＭＯペイメントゲートウェイ株式会社,渋谷区道玄坂一丁目２番３号,情報・通信業,35.657655,139.700311,東京都
192,3817.T,E05640,上場,有,1000.0,株式会社ＳＲＡホールディングス,豊島区南池袋二丁目３２番８号,情報・通信業,35.726626,139.71548,東京都
193,3092.T,E05725,上場,有,1359.0,株式会社ＺＯＺＯ,千葉市美浜区中瀬二丁目６番地１,小売業,35.649467,140.039181,千葉県
194,3626.T,E05739,上場,有,10001.0,ＴＩＳ株式会社,新宿区西新宿８丁目１７番１号,情報・通信業,35.696292,139.690659,東京都
195,8750.T,E06141,上場,有,343926.0,第一生命ホールディングス株式会社,千代田区有楽町一丁目１３番１号,保険業,35.675837,139.760817,東京都
196,6098.T,E07801,上場,有,40000.0,株式会社リクルートホールディングス,中央区銀座８－４－１７,サービス業,35.66858,139.759398,東京都
197,3141.T,E21035,上場,有,7736.0,ウエルシアホールディングス株式会社,千代田区外神田二丁目２番１５号,小売業,35.699456,139.767884,東京都
198,4578.T,E21183,上場,有,81690.0,大塚ホールディングス株式会社,千代田区神田司町２－９,医薬品,35.693506,139.766949,東京都
199,2269.T,E21902,上場,有,30000.0,明治ホールディングス株式会社,中央区京橋二丁目４番１６号,食料品,35.676928000000004,139.768971,東京都
200,8630.T,E23924,上場,有,100045.0,ＳＯＭＰＯホールディングス株式会社,新宿区西新宿一丁目２６番１号,保険業,35.692591,139.696522,東京都
201,5020.T,E24050,上場,有,100000.0,ＥＮＥＯＳホールディングス株式会社,千代田区大手町一丁目１番２号,石油・石炭製品,35.686064,139.761993,東京都
202,4581.T,E25678,上場,有,30000.0,大正製薬ホールディングス株式会社,豊島区高田三丁目２４番１号,医薬品,35.715146000000004,139.710093,東京都
203,3659.T,E25850,上場,有,51987.0,株式会社ネクソン,港区六本木一丁目４番５号,情報・通信業,35.665694,139.739445,東京都
204,4587.T,E27486,上場,無,3930.0,ペプチドリーム株式会社,川崎市川崎区殿町三丁目２５番２３号,医薬品,35.539343,139.758673,神奈川県
205,2587.T,E27622,上場,有,168384.0,サントリー食品インターナショナル株式会社,中央区京橋三丁目１番１号,食料品,35.6761,139.768382,東京都
206,3291.T,E27759,上場,有,10000.0,飯田グループホールディングス株式会社,武蔵野市西久保一丁目２番１１号,不動産業,35.704438,139.559236,東京都
207,3694.T,E30918,上場,無,443.0,株式会社オプティム,佐賀市本庄町１,情報・通信業,33.242882,130.293161,佐賀県
208,6178.T,E31748,上場,有,3500000.0,日本郵政株式会社,千代田区大手町二丁目３番１号,サービス業,35.686859000000005,139.767437,東京都
209,7181.T,E31755,上場,有,500000.0,株式会社かんぽ生命保険,千代田区大手町二丁目３番１号,保険業,35.686859000000005,139.767437,東京都
210,7182.T,E31775,上場,無,3500000.0,株式会社ゆうちょ銀行,千代田区丸の内二丁目７番２号,銀行業,35.679845,139.76472900000002,東京都
211,9143.T,E32292,上場,有,11882.0,ＳＧホールディングス株式会社,京都市南区上鳥羽角田町６８番地,陸運業,34.969512,135.747854,京都府
212,4385.T,E34064,上場,有,8789.0,株式会社メルカリ,港区六本木六丁目１０番１号六本木ヒルズ森タワー１８階,情報・通信業,35.660734999999995,139.729207,東京都
213,8951.T,E37332,上場,,,日本ビルファンド投資法人,千代田区丸の内一丁目9番1号,不動産業,35.68173,139.766185,東京都
214,3283.T,E37333,上場,,,日本プロロジスリート投資法人,千代田区丸の内二丁目7番3号,その他金融業,35.678607,139.764936,東京都
215,8952.T,E37334,上場,,,ジャパンリアルエステート投資法人,千代田区大手町一丁目1番1号,不動産業,35.686724,139.762621,東京都
216,3281.T,E37335,上場,,,GLP投資法人,港区東新橋一丁目5番2号,その他金融業,35.665619,139.760797,東京都
217,3462.T,E37336,上場,,,野村不動産マスターファンド投資法人,新宿区西新宿八丁目5番1号,その他金融業,35.694654,139.693058,東京都
218,3292.T,E37337,上場,,,イオンリート投資法人,千代田区神田錦町一丁目2番地1,その他金融業,35.692674,139.764609,東京都